{
  "format_version": "1.0",
  "project": {
    "id": "a1b2c3d4-e5f6-7890-abcd-ef1234567890",
    "name": "DESTINY Climate & Health",
    "description": "Vocabulary for classifying evidence on climate change and human health impacts.",
    "namespace": "https://vocab.destiny-evidence.org/climate-health"
  },
  "published_at": "2026-02-11T10:30:00Z",
  "vocabularies": [
    {
      "id": "b2c3d4e5-f6a7-8901-bcde-f12345678901",
      "title": "Intervention Types",
      "description": "Classification of climate-health interventions and adaptation strategies.",
      "version_label": "1.0",
      "term_count": 12,
      "file": "vocab-b2c3d4e5-f6a7-8901-bcde-f12345678901.json"
    },
    {
      "id": "c3d4e5f6-a7b8-9012-cdef-123456789012",
      "title": "Health Outcomes",
      "description": "Categories of health outcomes linked to climate exposure.",
      "version_label": "1.0",
      "term_count": 8,
      "file": "vocab-c3d4e5f6-a7b8-9012-cdef-123456789012.json"
    }
  ]
}
